{
  "$schema": "http://json-schema.org/draft-07/schema#",
  "type": "object",
  "properties": {
    "id": {
      "type": [
        "null",
        "string"
      ]
    },
    "description": {
      "type": [
        "null",
        "string"
      ]
    },
    "file_type": {
      "type": [
        "null",
        "string"
      ]
    },
    "file_size": {
      "type": [
        "null",
        "integer"
      ]
    },
    "expense_id": {
      "type": [
        "null",
        "string"
      ]
    },
    "in_inbox": {
      "type": [
        "null",
        "boolean"
      ]
    },
    "created_at": {
      "type": [
        "null",
        "string"
      ],
      "format": "date-time"
    },
    "receipt_value": {
      "type": [
        "null",
        "object"
      ],
      "properties": {
        "description": {
          "type": [
            "null",
            "string"
          ]
        },
        "invoice_number": {
          "type": [
            "null",
            "string"
          ]
        },
        "invoice_date": {
          "type": [
            "null",
            "string"
          ],
          "format": "date"
        },
        "vat_type": {
          "type": [
            "null",
            "string"
          ]
        },
        "amount_incl_vat": {
          "type": [
            "null",
            "object"
          ],
          "properties": {
            "amount": {
              "type": [
                "null",
                "string"
              ]
            },
            "currency": {
              "type": [
                "null",
                "string"
              ]
            }
          }
        },
        "amount_excl_vat": {
          "type": [
            "null",
            "object"
          ],
          "properties": {
            "amount": {
              "type": [
                "null",
                "string"
              ]
            },
            "currency": {
              "type": [
                "null",
                "string"
              ]
            }
          }
        },
        "iban_codes": {
          "type": [
            "null",
            "array"
          ],
          "items": {
            "type": [
              "null",
              "string"
            ]
          }
        },
        "vat_numbers": {
          "type": [
            "null",
            "array"
          ],
          "items": {
            "type": [
              "null",
              "string"
            ]
          }
        },
        "coc_numbers": {
          "type": [
            "null",
            "array"
          ],
          "items": {
            "type": [
              "null",
              "string"
            ]
          }
        }
      }
    }
  }
}
